Question,Question_Feature_Image,,Options_Quantity,,optionText-1,isOptionCorrect-1,resultText-1,,optionText-2,isOptionCorrect-2,resultText-2,,optionText-3,isOptionCorrect-3,resultText-3,,optionText-4,isOptionCorrect-4,resultText-4
This graphic went viral on social media but was debunked. What should make you doubt it?,quiz-images/trumpexample.jpg,,4,,The font looks too formal,FALSE,"The font, date, and photo aren't the problem--it's the lack of a source! Anyone can photoshop words on top of an image. Memes like this can originate from satire sites, hacked accounts, or tabloids that make stuff up so you grab them while paying for toilet paper. Beware! (Source: <a href=""https://www.cnn.com/2016/11/10/politics/trump-quote-facebook-trnd/index.html"" target=""_blank"">CNN</a>)",,No link to an original post,TRUE,"The font, date, and photo aren't the problem--it's the lack of a source! Anyone can photoshop words on top of an image. Memes like this can originate from satire sites, hacked accounts, or tabloids that make stuff up so you grab them while paying for toilet paper. Beware! (Source: <a href=""https://www.cnn.com/2016/11/10/politics/trump-quote-facebook-trnd/index.html"" target=""_blank"">CNN</a>)",,The date,FALSE,"The font, date, and photo aren't the problem--it's the lack of a source! Anyone can photoshop words on top of an image. Memes like this can originate from satire sites, hacked accounts, or tabloids that make stuff up so you grab them while paying for toilet paper. Beware! (Source: <a href=""https://www.cnn.com/2016/11/10/politics/trump-quote-facebook-trnd/index.html"" target=""_blank"">CNN</a>)",,The cheesy photo,FALSE,"The font, date, and photo aren't the problem--it's the lack of a source! Anyone can photoshop words on top of an image. Memes like this can originate from satire sites, hacked accounts, or tabloids that make stuff up so you grab them while paying for toilet paper. Beware! (Source: <a href=""https://www.cnn.com/2016/11/10/politics/trump-quote-facebook-trnd/index.html"" target=""_blank"">CNN</a>)"
This article questions whether Hillary Clinton really had pneumonia when she ran for president. What makes you think twice about this reporting?,quiz-images/Hillary_Breitbart.jpg,,4,,Everything you read about Hillary Clinton in the media is false.,FALSE,"There are lots of issues with this article, but the biggest one is the author's use of alarming, speculative claims. Let's say my friend has a pimple, but I tell the whole school she has herpes, and she doesn't get a date to prom. That's like this article, except what was at stake was who leads America. (Source: <a href=""http://www.breitbart.com/big-government/2016/09/15/doctors-see-inconsistencies-hillary-clintons-bacterial-pneumonia-diagnosis/"" target=""_blank"">Breitbart</a>)",,"In the picture used, Hillary looks totally healthy.",FALSE,"There are lots of issues with this article, but the biggest one is the author's use of alarming, speculative claims. Let's say my friend has a pimple, but I tell the whole school she has herpes, and she doesn't get a date to prom. That's like this article, except what was at stake was who leads America. (Source: <a href=""http://www.breitbart.com/big-government/2016/09/15/doctors-see-inconsistencies-hillary-clintons-bacterial-pneumonia-diagnosis/"" target=""_blank"">Breitbart</a>)",,The article only includes an excerpt from the official report from Clinton's doctor.,FALSE,"There are lots of issues with this article, but the biggest one is the author's use of alarming, speculative claims. Let's say my friend has a pimple, but I tell the whole school she has herpes, and she doesn't get a date to prom. That's like this article, except what was at stake was who leads America. (Source: <a href=""http://www.breitbart.com/big-government/2016/09/15/doctors-see-inconsistencies-hillary-clintons-bacterial-pneumonia-diagnosis/"" target=""_blank"">Breitbart</a>)",,"Without evidence, the author hints that Clinton has a super-serious degenerative disease",TRUE,"There are lots of issues with this article, but the biggest one is the author's use of alarming, speculative claims. Let's say my friend has a pimple, but I tell the whole school she has herpes, and she doesn't get a date to prom. That's like this article, except what was at stake was who leads America. (Source: <a href=""http://www.breitbart.com/big-government/2016/09/15/doctors-see-inconsistencies-hillary-clintons-bacterial-pneumonia-diagnosis/"" target=""_blank"">Breitbart</a>)"
This article says cops send people to jail on the basis of a drug test known for false positives. Why trust this story?,quiz-images/Propublica_news.jpg,,4,,The article cites technical scientific terms a person wouldn't know unless they'd done their research.,FALSE,"Even well-known, tech-savvy reporters at nonprofits can get the story wrong. But you know you can trust this one because the sources are right there, offered in an unbiased way. (Source: <a href=""https://www.propublica.org/article/common-roadside-drug-test-routinely-produces-false-positives"" target=""_blank"">ProPublica</a>)",,The publication is non-profit and therefore does not pander to special interests.,FALSE,"Even well-known, tech-savvy reporters at nonprofits can get the story wrong. But you know you can trust this one because the sources are right there, offered in an unbiased way. (Source: <a href=""https://www.propublica.org/article/common-roadside-drug-test-routinely-produces-false-positives"" target=""_blank"">ProPublica</a>)",,The author is well known.,FALSE,"Even well-known, tech-savvy reporters at nonprofits can get the story wrong. But you know you can trust this one because the sources are right there, offered in an unbiased way. (Source: <a href=""https://www.propublica.org/article/common-roadside-drug-test-routinely-produces-false-positives"" target=""_blank"">ProPublica</a>)",,"The reporter uses an unbiased voice, cites multiple named sources, and includes reliable hyperlinks.",TRUE,"Even well-known, tech-savvy reporters at nonprofits can get the story wrong. But you know you can trust this one because the sources are right there, offered in an unbiased way. (Source: <a href=""https://www.propublica.org/article/common-roadside-drug-test-routinely-produces-false-positives"" target=""_blank"">ProPublica</a>)"
"Freaked out that her daughter will have to register for the draft, your aunt shares this New York Times story the week Trump takes office. What's wrong with that?",quiz-images/NYtimes_draft.jpg,,4,,There's no way the U.S. Senate would ever force females to register for the draft.,FALSE,"This story was perfectly accurate--at the time it was published. But it went viral 10 months later, when people started sharing it like crazy long after the provision was killed. Timing is everything, so check your dates! (Source: <a href=""https://www.nytimes.com/2016/06/15/us/politics/congress-women-military-draft.html"" target=""_blank"">NY Times</a>)",,It's an accurate but outdated story about part of a bill that didn't pass.,TRUE,"This story was perfectly accurate--at the time it was published. But it went viral 10 months later, when people started sharing it like crazy long after the provision was killed. Timing is everything, so check your dates! (Source: <a href=""https://www.nytimes.com/2016/06/15/us/politics/congress-women-military-draft.html"" target=""_blank"">NY Times</a>)",,You should only trust coverage of the military written by active duty personnel.,FALSE,"This story was perfectly accurate--at the time it was published. But it went viral 10 months later, when people started sharing it like crazy long after the provision was killed. Timing is everything, so check your dates! (Source: <a href=""https://www.nytimes.com/2016/06/15/us/politics/congress-women-military-draft.html"" target=""_blank"">NY Times</a>)",,The photo comes from 'Getty Images' and not the New York Times,FALSE,"This story was perfectly accurate--at the time it was published. But it went viral 10 months later, when people started sharing it like crazy long after the provision was killed. Timing is everything, so check your dates! (Source: <a href=""https://www.nytimes.com/2016/06/15/us/politics/congress-women-military-draft.html"" target=""_blank"">NY Times</a>)"
This article claims that there's proof that Democrats hired actors to play white supremacists in order to stage the protests in Charlottesville. How can you tell if this story is true or false?,quiz-images/Charlottesvillequestion.jpg,,4,,It's true because there are screenshots that corroborate the claims made in the article.,FALSE,"There's nothing that connects the Craigslist ad referenced in the article to the Charlottesville protests. While it's not 100% impossible that this claim is true, the screenshots are not proof of a hoax (Source: News Up Today)",,It's true because the story sounds plausible and doesn't contradict any known facts.,FALSE,"There's nothing that connects the Craigslist ad referenced in the article to the Charlottesville protests. While it's not 100% impossible that this claim is true, the screenshots are not proof of a hoax (Source: News Up Today)",,It's false because the proof cited in the article is not conclusive.,TRUE,"There's nothing that connects the Craigslist ad referenced in the article to the Charlottesville protests. While it's not 100% impossible that this claim is true, the screenshots are not proof of a hoax (Source: News Up Today)",,It's false because the tone of the article is biased.,FALSE,"There's nothing that connects the Craigslist ad referenced in the article to the Charlottesville protests. While it's not 100% impossible that this claim is true, the screenshots are not proof of a hoax (Source: News Up Today)"
"This story was widely circulated in the wake of the eclipse on August 21, 2017. What might indicate that this article is unreliable?",quiz-images/eclipsequestion.jpg,,4,,The grammar and spelling errors,FALSE,"Many signs suggest this story is whack. The spelling, grammar, and punctuation are off. The science is confusing and inaccurate. And the source is an exact copy of this same article on another website, which uses this version of the article as its source. (Source: Reflection of Mind)",,The questionable source listed,FALSE,"Many signs suggest this story is whack. The spelling, grammar, and punctuation are off. The science is confusing and inaccurate. And the source is an exact copy of this same article on another website, which uses this version of the article as its source. (Source: Reflection of Mind)",,The shaky explanation of the science,FALSE,"Many signs suggest this story is whack. The spelling, grammar, and punctuation are off. The science is confusing and inaccurate. And the source is an exact copy of this same article on another website, which uses this version of the article as its source. (Source: Reflection of Mind)",,All of the above,TRUE,"Many signs suggest this story is whack. The spelling, grammar, and punctuation are off. The science is confusing and inaccurate. And the source is an exact copy of this same article on another website, which uses this version of the article as its source. (Source: Reflection of Mind)"
Someone shares this post on your social media feed. What's the best way to figure out whether you should trust this story?,quiz-images/rosaparksquestion.jpg,,4,,See if you agree with the author's opinion,FALSE,"Sure, you can check your hunches and ask your friends, but if the cold hard facts behind a story aren't solid, you shouldn’t trust it. In this case, a simple search would reveal that several sites have debunked this article. Also: Rosa Parks never had children! (Source: ForFreedomWorld)",,Research the facts to verify the author's claims,TRUE,"Sure, you can check your hunches and ask your friends, but if the cold hard facts behind a story aren't solid, you shouldn’t trust it. In this case, a simple search would reveal that several sites have debunked this article. Also: Rosa Parks never had children! (Source: ForFreedomWorld)",,Ask your friends if they think it's true,FALSE,"Sure, you can check your hunches and ask your friends, but if the cold hard facts behind a story aren't solid, you shouldn’t trust it. In this case, a simple search would reveal that several sites have debunked this article. Also: Rosa Parks never had children! (Source: ForFreedomWorld)",,Check who else in your feeds has shared it,FALSE,"Sure, you can check your hunches and ask your friends, but if the cold hard facts behind a story aren't solid, you shouldn’t trust it. In this case, a simple search would reveal that several sites have debunked this article. Also: Rosa Parks never had children! (Source: ForFreedomWorld)"